{
  "schema_version": "0.1.0",
  "dataset": "ucdp",
  "dataset_version": "synthetic-0.1.0",
  "fixture_notice": "Synthetic demonstration records shaped like selected UCDP GED fields. These are not UCDP observations and must not be cited as research data.",
  "records": [
    {
      "ref": "ucdp:UCDP-SYN-001",
      "native_id": "UCDP-SYN-001",
      "native_sha256": "sha256:620b92f8c050203281f85a521b9b6fb8a77839864c647e16e6d09e6872531d65",
      "native": {
        "id": "UCDP-SYN-001",
        "relid": "SYN-UKR-2014-001",
        "type_of_violence": 1,
        "conflict_name": "Synthetic Crimea conflict",
        "dyad_name": "Government of Ukraine - Synthetic armed group",
        "side_a": "Government of Ukraine",
        "side_b": "Synthetic armed group",
        "country": "Ukraine",
        "adm_1": "Crimea",
        "where_prec": "Simferopol International Airport",
        "date_start": "2014-02-27",
        "date_end": "2014-02-27",
        "best": 1,
        "source_article": "Synthetic fixture narrative A"
      }
    },
    {
      "ref": "ucdp:UCDP-SYN-002",
      "native_id": "UCDP-SYN-002",
      "native_sha256": "sha256:f01838b20e585febdee5b2bd763c2747f97c5e46d595e633216af2d7c92938db",
      "native": {
        "id": "UCDP-SYN-002",
        "relid": "SYN-UKR-2014-002",
        "type_of_violence": 1,
        "conflict_name": "Synthetic Crimea conflict",
        "dyad_name": "Government of Ukraine - Synthetic armed group",
        "side_a": "Government of Ukraine",
        "side_b": "Synthetic armed group",
        "country": "Ukraine",
        "adm_1": "Crimea",
        "where_prec": "Sevastopol naval district",
        "date_start": "2014-03-01",
        "date_end": "2014-03-03",
        "best": 0,
        "source_article": "Synthetic fixture narrative B"
      }
    },
    {
      "ref": "ucdp:UCDP-SYN-003",
      "native_id": "UCDP-SYN-003",
      "native_sha256": "sha256:c973794eedf7ddf21fec2753510d526e072945f28af9b6c6d4263281b60c1be9",
      "native": {
        "id": "UCDP-SYN-003",
        "relid": "SYN-UKR-2014-003",
        "type_of_violence": 1,
        "conflict_name": "Synthetic Crimea conflict",
        "dyad_name": "Government of Ukraine - Synthetic armed group",
        "side_a": "Government of Ukraine",
        "side_b": "Synthetic armed group",
        "country": "Ukraine",
        "adm_1": "Crimea",
        "where_prec": "Perevalne",
        "date_start": "2014-03-04",
        "date_end": "2014-03-04",
        "best": 2,
        "source_article": "Synthetic fixture narrative C"
      }
    },
    {
      "ref": "ucdp:UCDP-SYN-004",
      "native_id": "UCDP-SYN-004",
      "native_sha256": "sha256:1504f68dfbe3bd52af2b37fda673146ce54f02c84995148b966f98375958d17e",
      "native": {
        "id": "UCDP-SYN-004",
        "relid": "SYN-UKR-2014-004",
        "type_of_violence": 1,
        "conflict_name": "Synthetic Crimea conflict",
        "dyad_name": "Government of Ukraine - Synthetic armed group",
        "side_a": "Government of Ukraine",
        "side_b": "Synthetic armed group",
        "country": "Ukraine",
        "adm_1": "Crimea",
        "where_prec": "Kerch outskirts",
        "date_start": "2014-03-18",
        "date_end": "2014-03-18",
        "best": 1,
        "source_article": "Synthetic fixture narrative D; intentionally has no ACLED counterpart"
      }
    }
  ]
}
